{
  "approval": {
    "approved_at": "2026-09-27",
    "approved_by": "ルール所有者",
    "evidence": []
  },
  "approved_fingerprint": "57e0d74701fc85d955886c60cb616986240a460daa9dce49c0b91189db19b1d2",
  "approved_vector_count": 141,
  "artifact_sets": [
    {
      "artifacts": [
        {
          "content_kind": "text",
          "hash_profile": "afwi-content-sha256-v1",
          "media_type": "text/markdown",
          "path": "rule-core/docs/design/AFWI-KAI_Rule_Core_バージョン管理・リリース方針-01.md",
          "sha256": "b8cf907ca153110b66ac7af1d9e6af3e46feb7265be44bcc16b9cf5db05b0953"
        },
        {
          "content_kind": "text",
          "hash_profile": "afwi-content-sha256-v1",
          "media_type": "application/json",
          "path": "rule-core/schemas/release-catalog.schema.json",
          "sha256": "22ed80fa5598917ff1dea0b90e89ade2277b51d497125b72daf725316a48870d"
        },
        {
          "content_kind": "text",
          "hash_profile": "afwi-content-sha256-v1",
          "media_type": "application/json",
          "path": "rule-core/schemas/release-integrity-declarations.schema.json",
          "sha256": "7957f53773c87b58bbfd393f6aa6d0e64b51e6582c7c0246aef93da78e690295"
        },
        {
          "content_kind": "text",
          "hash_profile": "afwi-content-sha256-v1",
          "media_type": "application/json",
          "path": "rule-core/schemas/release-manifest.schema.json",
          "sha256": "f98f499a7d6bd14ae143cf2abffeedce7c5882018c7063985d39d296b7805d25"
        }
      ],
      "distribution_class": "public",
      "role": "normative",
      "set_id": "public-release-governance"
    },
    {
      "artifacts": [
        {
          "content_kind": "text",
          "hash_profile": "afwi-content-sha256-v1",
          "media_type": "application/yaml",
          "path": "rule-core/data/emi-components.yaml",
          "sha256": "22ba7a2358281c1818b291f64808aef273511f0b976dbefc6d157393977ff775"
        },
        {
          "content_kind": "text",
          "hash_profile": "afwi-content-sha256-v1",
          "media_type": "application/yaml",
          "path": "rule-core/data/enablers.yaml",
          "sha256": "ba92684465208611b9d5d9a313ddd425c18f0635250dbac985857f1e80cd2116"
        },
        {
          "content_kind": "text",
          "hash_profile": "afwi-content-sha256-v1",
          "media_type": "application/yaml",
          "path": "rule-core/data/geography.yaml",
          "sha256": "ee4ec63a5d5d183d5862926378e5bff0d2a02bddbe03bf709e6db6b03848b382"
        },
        {
          "content_kind": "text",
          "hash_profile": "afwi-content-sha256-v1",
          "media_type": "application/yaml",
          "path": "rule-core/data/rates.yaml",
          "sha256": "f041c310a5ca9c34bb3d7b57d2f5d10a18070d16aa357cdd8e577d7ab64838b7"
        },
        {
          "content_kind": "text",
          "hash_profile": "afwi-content-sha256-v1",
          "media_type": "application/yaml",
          "path": "rule-core/data/squadron-activation.yaml",
          "sha256": "30a3d5ad72ed643fec9df9412d7008c66a666bd71a0665e00a6b9245766d3b32"
        },
        {
          "content_kind": "text",
          "hash_profile": "afwi-content-sha256-v1",
          "media_type": "application/yaml",
          "path": "rule-core/data/squadrons.yaml",
          "sha256": "a5f9de4e583f553faa7ce79bf70c004ecb5f135d0cb14b094174f1c84bce3676"
        },
        {
          "content_kind": "text",
          "hash_profile": "afwi-content-sha256-v1",
          "media_type": "application/yaml",
          "path": "rule-core/data/state-and-event-ids.yaml",
          "sha256": "e3eb8044a3615f48c3fcd1da9755918fe333c9aa1d970f845152a970a92d4d50"
        },
        {
          "content_kind": "text",
          "hash_profile": "afwi-content-sha256-v1",
          "media_type": "application/yaml",
          "path": "rule-core/governance/component-id-registry.yaml",
          "sha256": "290c704f6d0daed590838fc4c2a4f30148400466cb96b7bd6a62cd9de0200ee2"
        },
        {
          "content_kind": "text",
          "hash_profile": "afwi-content-sha256-v1",
          "media_type": "application/yaml",
          "path": "rule-core/governance/decisions.yaml",
          "sha256": "776068cd1f8c4ecfdf9488b6d9d31409b71e2aa10d88cfc5266f349fb5c32417"
        },
        {
          "content_kind": "text",
          "hash_profile": "afwi-content-sha256-v1",
          "media_type": "application/yaml",
          "path": "rule-core/governance/rule-id-registry.yaml",
          "sha256": "32067afafbd53fe030de46e7bebd3de05ce57c71e0964fd27cf45fa53c4b1021"
        },
        {
          "content_kind": "text",
          "hash_profile": "afwi-content-sha256-v1",
          "media_type": "text/markdown",
          "path": "rule-core/rules/combat.md",
          "sha256": "beb81d4d5757d232441ad0fb897969d5563b26ff95d826c829a77603170648c2"
        },
        {
          "content_kind": "text",
          "hash_profile": "afwi-content-sha256-v1",
          "media_type": "text/markdown",
          "path": "rule-core/rules/cyber-target-groups.md",
          "sha256": "c1523ed4d74d31f7987f11dca07d1d5d5b4a36df26a1f6b6247b9fbfbd040705"
        },
        {
          "content_kind": "text",
          "hash_profile": "afwi-content-sha256-v1",
          "media_type": "text/markdown",
          "path": "rule-core/rules/detection-and-intel.md",
          "sha256": "b87d9b48c597fdabbc5c6eff724391f1bc2e5f976a9829d6ef7743e2afaf66ab"
        },
        {
          "content_kind": "text",
          "hash_profile": "afwi-content-sha256-v1",
          "media_type": "text/markdown",
          "path": "rule-core/rules/emi.md",
          "sha256": "e77486851f2ff49ceda71e0105608bc1d415e3bd6918097e504d6e6daf205396"
        },
        {
          "content_kind": "text",
          "hash_profile": "afwi-content-sha256-v1",
          "media_type": "text/markdown",
          "path": "rule-core/rules/enablers.md",
          "sha256": "f6145079c5d4d97c8e49ea5c04e9eebdfc0810a0c151bff8101ed3c53e22ca87"
        },
        {
          "content_kind": "text",
          "hash_profile": "afwi-content-sha256-v1",
          "media_type": "text/markdown",
          "path": "rule-core/rules/interaction-and-visibility.md",
          "sha256": "f19f9f7e7abe9ea952c02bd1d384e346128c650d9c0f85ed4a193a16f1d9db2e"
        },
        {
          "content_kind": "text",
          "hash_profile": "afwi-content-sha256-v1",
          "media_type": "text/markdown",
          "path": "rule-core/rules/rates.md",
          "sha256": "3a2e5f2ef38ad2c980910c18bf720ae69982e44a9e325f423744b152548649fd"
        },
        {
          "content_kind": "text",
          "hash_profile": "afwi-content-sha256-v1",
          "media_type": "text/markdown",
          "path": "rule-core/rules/squadron-activation.md",
          "sha256": "6eeeb08ec973033a147024a54065d510f767da38c4cfa41a6bc4ea6c7ab92bc6"
        },
        {
          "content_kind": "text",
          "hash_profile": "afwi-content-sha256-v1",
          "media_type": "text/markdown",
          "path": "rule-core/rules/turn-base-star-payment.md",
          "sha256": "e80719df5d02da3dc65a942c9575e435a44d9342ac9a9e197ed2978c9a1cc54a"
        },
        {
          "content_kind": "text",
          "hash_profile": "afwi-content-sha256-v1",
          "media_type": "application/yaml",
          "path": "rule-core/tests/rule-vectors/cyber-target-group-candidates.yaml",
          "sha256": "379ec727e0566ed9358e64fd7f53482b76e2f437048b411c999c6a2b30fc316c"
        },
        {
          "content_kind": "text",
          "hash_profile": "afwi-content-sha256-v1",
          "media_type": "application/yaml",
          "path": "rule-core/tests/rule-vectors/turn-base-star-payment-candidates.yaml",
          "sha256": "c950225358f20696150603fbf09e0c30ec188fdf7210be20edf2226021691df0"
        }
      ],
      "distribution_class": "rights-pending",
      "role": "normative",
      "set_id": "rights-pending-normative-payload"
    },
    {
      "artifacts": [
        {
          "content_kind": "text",
          "hash_profile": "afwi-content-sha256-v1",
          "media_type": "application/yaml",
          "path": "rule-core/governance/coverage.yaml",
          "sha256": "1f93da5181bd0b6e02fb3962c186906e806d7a5116bd64ee2c0bbf87bf7407fc"
        },
        {
          "content_kind": "text",
          "hash_profile": "afwi-content-sha256-v1",
          "media_type": "application/yaml",
          "path": "rule-core/governance/field-ownership.yaml",
          "sha256": "b59c20756370ca0864f497eb7e8f872b5142d210edacbe9a30e907a7c4ebf5ef"
        },
        {
          "content_kind": "text",
          "hash_profile": "afwi-content-sha256-v1",
          "media_type": "application/yaml",
          "path": "rule-core/governance/release-integrity-declarations.yaml",
          "sha256": "fb328173113d82c0276530e77980490f119ad0f32bd39fdf1f517ddfe5a9b802"
        },
        {
          "content_kind": "text",
          "hash_profile": "afwi-content-sha256-v1",
          "media_type": "application/yaml",
          "path": "rule-core/governance/source-fragment-register.yaml",
          "sha256": "19b8c23e3698bdddcd27504ab20e2ce43df2fbc753189b8f9418e7e582ae94cc"
        },
        {
          "content_kind": "text",
          "hash_profile": "afwi-content-sha256-v1",
          "media_type": "application/yaml",
          "path": "rule-core/governance/source-register.yaml",
          "sha256": "f11db30a4859c1499af0d264e95fd3c55fe0b7fcc1c073e10610821e19ed5876"
        },
        {
          "content_kind": "text",
          "hash_profile": "afwi-content-sha256-v1",
          "media_type": "application/yaml",
          "path": "rule-core/governance/traceability.yaml",
          "sha256": "c92f1ae6691498b7ea48afe411b9a12ba6561fb00798cee94443d0a9fbebc032"
        },
        {
          "content_kind": "text",
          "hash_profile": "afwi-content-sha256-v1",